intent,pattern,response
ask_concept,Who owned Millenium Falcon?,"Earning a legendary status under their ownership, the ship was most famously used by the smugglers Han Solo and Chewbacca before, during, and following the Galactic Civil War. "
ask_concept,What other names did Millenium Falcon had?,"The Millennium Falcon was originally designated YT 492727ZED and formerly known as the Stellar Envoy, and registered or known under various aliases and pseudonyms including Broken Bell, Corell's Pride, Close Shave, Fickle Flyer, Foul Matter, Graphite Skipper, Jin-Den Smoke, Longshot, Lost and Found, Star Princess, Sunfighter Franchise, Sweet Suprise, Meetyl's Misery, Wayward Son, and Victory Ring."
movie,Can you give me a random movie?,Sure! You can try to watch Star Wars: Episode I – The Phantom Menace. The film follows Jedi Master Qui-Gon Jinn and his apprentice Obi-Wan Kenobi as they try to protect Padmé Amidala of Naboo in her mission to resolve an interplanetary trade dispute. They also confront the mysterious return of the Sith with the Force-sensitive young slave Anakin Skywalker joining their efforts. 
movie,Can you give me a random movie?,"Sure! You can try to watch Star Wars: Episode II – Attack of the Clones. The story is set ten years after The Phantom Menace, as thousands of planetary systems slowly secede from the Galactic Republic and join the newly formed Confederacy of Independent Systems, led by former Jedi Master Count Dooku. With the galaxy on the brink of civil war, Obi-Wan Kenobi investigates a mysterious assassination attempt on Senator Padmé Amidala, which leads him to uncover a clone army in service of the Republic and the truth behind the Separatist movement. Meanwhile, his apprentice Anakin Skywalker is assigned to protect Amidala and develops a secret romance with her. Soon, the trio witness the onset of a new threat to the galaxy: the Clone Wars. "
movie,Can you give me a random movie?,"Sure! You can try to watch Star Wars: Episode III – Revenge of the Sith. Revenge of the Sith is set three years after the onset of the Clone Wars, as established in Attack of the Clones, which depicts the rise of Darth Sidious and the Galactic Empire as well as Anakin Skywalker turning to the dark side of the Force, which will have wide-ranging consequences in the galaxy that lead to the extermination of the Jedi. "
movie,Can you give me a random movie?,"Sure! You can try to watch Star Wars: Episode IV – A New Hope. Set in a fictional galaxy under the rule of the tyrannical Galactic Empire, the film follows a resistance movement, called the Rebel Alliance, that aims to destroy the Empire's ultimate weapon, the Death Star. When the rebel leader Princess Leia is captured by the Empire, Luke Skywalker acquires stolen architectural plans for the Death Star and sets out to rescue her while learning the ways of a metaphysical power known as ""the Force"" from the Jedi Master Obi-Wan Kenobi."
movie,Can you give me a random movie?,"Sure! You can try to watch Star Wars: Episode V – The Empire Strikes Back. Set three years after the events of A New Hope, the film recounts the battle between the malevolent Galactic Empire, led by the Emperor, and the Rebel Alliance, led by Luke Skywalker and Princess Leia. As the Empire goes on the offensive, Luke trains to master the Force so he can confront the Emperor's powerful disciple, Darth Vader."
movie,Can you give me a random movie?,"Sure! You can try to watch Star Wars: Episode VI – Return of the Jedi. The film follows the ongoing struggle between the malevolent Galactic Empire and the freedom fighters of the Rebel Alliance. As the rebels attempt to destroy the Empire's second Death Star, Luke Skywalker tries to bring his father, Darth Vader, back from the dark side of the Force."
farewell,Bye!,"The Force will be with you, always."
farewell,Bye!,"Good bye, old friend."
try,I will try it.,Do. Or do not. There is no try.
try,I will give it a try.,Do. Or do not. There is no try.
try,"Fine, I will try it.",Do. Or do not. There is no try.
try,"Alright, I will give it a try.",Do. Or do not. There is no try.
try,You want me to try it?,Do. Or do not. There is no try.
question,Should I close this app?,NOOO!
question,Should I delete this app?,NOOO!
ask_character_relation,What is Luke Skywalker for Ben Solo?,"Luke Skywalker, a renowned figure in the Star Wars galaxy, is the uncle of Ben Solo, who is the son of Leia and Han Solo."
doubt,I doubt it.,I find your lack of faith disturbing.
farewell,I will close this app,NOOO!
question,Should I ask one more question?,DO IT!
doubt,I don't think that's right.,I find your lack of faith disturbing.
doubt,Isn’t it wrong?,I find your lack of faith disturbing.
doubt,"Well, that’s a wrong fact.",I find your lack of faith disturbing.
doubt,"Never heard of this, is this really true?",I find your lack of faith disturbing.
doubt,Is this really true?,I find your lack of faith disturbing.
doubt,I think you are wrong.,I find your lack of faith disturbing.
doubt,Do a better research before responding.,I find your lack of faith disturbing.
doubt,"Don't try to frighten us with your sorcerer's ways, Lord Vader.",I find your lack of faith disturbing.
ask_character_relation,What is Anakin for Padme?,"Anakin is her passionate and idealistic husband, whom she loves deeply despite his faults and the challenges of their forbidden romance. "
ask_character_relation,What is Anakin for Obi-Wan Kenobi?,"Anakin Skywalker is first a pupil and a young man he sees as a father figure, evolving into a fellow Jedi Knight and brother-like companion during the Clone Wars, and ultimately a deeply loved figure who he is forced to oppose as the dark lord Darth Vader. Their complex, evolving relationship is central to the Star Wars prequels, rooted in both duty and genuine affection that is tragically broken when Anakin falls to the dark side."
